title,original_title,release_date,duration_minutes,age_rating,imdb_score,imdb_vote_count,genres,poster_url,cover_url,trailer_url,description,storyline,cast_directors,cast_writers,cast_actors,year
Léon: The Professional,,1994,110,R,8.5,,"Action, Crime, Drama",https://placehold.co/600x900/png?text=Léon:+The+Professional,https://placehold.co/1280x720/png?text=Léon:+The+Professional,https://www.youtube.com/watch?v=TEN-2uTi2c0,"12-year-old Mathilda is reluctantly taken in by Léon, a professional assassin, after her family is murdered. An unusual relationship forms as she becomes his protégée and learns the assassin's trade.","Mathilda, a 12-year-old girl, is reluctantly taken in by Léon, a professional assassin, after her family is murdered.",Luc Besson,,Jean Reno (Léon); Gary Oldman (Stansfield); Natalie Portman (Mathilda),1994
The Lion King,,1994,88,G,8.5,,"Animation, Adventure, Drama",https://placehold.co/600x900/png?text=The+Lion+King,https://placehold.co/1280x720/png?text=The+Lion+King,https://www.youtube.com/watch?v=O9EvBdzHvqI,"Lion prince Simba and his father are targeted by his bitter uncle, who wants to ascend the throne himself.","A young lion prince is cast out of his pride by his cruel uncle, who claims he killed his father.",Roger Allers,Rob Minkoff,,1994
Gladiator,,2000,155,R,8.5,,"Action, Adventure, Drama",https://placehold.co/600x900/png?text=Gladiator,https://placehold.co/1280x720/png?text=Gladiator,https://www.youtube.com/watch?v=MfM79O9O2MA,A former Roman General sets out to exact vengeance against the corrupt emperor who murdered his family and sent him into slavery.,"Maximus is a powerful Roman general, loved by the people and the aging Emperor, Marcus Aurelius.",Ridley Scott,,Russell Crowe (Maximus); Joaquin Phoenix (Commodus); Connie Nielsen (Lucilla),2000
American History X,,1998,119,R,8.5,,Drama,https://placehold.co/600x900/png?text=American+History+X,https://placehold.co/1280x720/png?text=American+History+X,https://www.youtube.com/watch?v=90CEndhYx88,A former neo-nazi skinhead tries to prevent his younger brother from going down the same wrong path that he did.,Derek Vinyard is paroled after serving 3 years in prison for killing two black men.,Tony Kaye,,Edward Norton (Derek Vinyard); Edward Furlong (Danny Vinyard); Beverly D'Angelo (Doris Vinyard),1998
The Departed,,2006,151,R,8.5,,"Crime, Drama, Thriller",https://placehold.co/600x900/png?text=The+Departed,https://placehold.co/1280x720/png?text=The+Departed,https://www.youtube.com/watch?v=iojhqm0JTW4,An undercover cop and a mole in the police attempt to identify each other while infiltrating an Irish gang in South Boston.,"In South Boston, the state police force is waging war on Irish-American organized crime.",Martin Scorsese,,Leonardo DiCaprio (Billy Costigan); Matt Damon (Colin Sullivan); Jack Nicholson (Frank Costello),2006
The Prestige,,2006,130,PG-13,8.5,,"Drama, Mystery, Sci-Fi",https://placehold.co/600x900/png?text=The+Prestige,https://placehold.co/1280x720/png?text=The+Prestige,https://www.youtube.com/watch?v=G8ozbqgdIjY,"After a tragic accident, two stage magicians engage in a battle to create the ultimate illusion while sacrificing everything they have to outwit each other.","In the end of the nineteenth century, in London, Robert Angier, his beloved wife Julia McCullough, and Alfred Borden are friends and assistants of a magician.",Christopher Nolan,,Hugh Jackman (Robert Angier); Christian Bale (Alfred Borden); Scarlett Johansson (Olivia Wenscombe),2006
Whiplash,,2014,106,R,8.5,,"Drama, Music",https://placehold.co/600x900/png?text=Whiplash,https://placehold.co/1280x720/png?text=Whiplash,https://www.youtube.com/watch?v=MTVOz89_JS4,A promising young drummer enrolls at a cut-throat music conservatory where his dreams of greatness are mentored by an instructor who will stop at nothing to realize a student's potential.,"Andrew Neiman is an ambitious young jazz drummer, single-minded in his pursuit to rise to the top of his elite east coast music conservatory.",Damien Chazelle,,Miles Teller (Andrew); J.K. Simmons (Fletcher); Melissa Benoist (Nicole),2014
The Intouchables,,2011,112,R,8.5,,"Biography, Comedy, Drama",https://placehold.co/600x900/png?text=The+Intouchables,https://placehold.co/1280x720/png?text=The+Intouchables,https://www.youtube.com/watch?v=dvdJ--DV0Uo,"After he becomes a quadriplegic from a paragliding accident, an aristocrat hires a young man from the projects to be his caregiver.","In Paris, the aristocratic and intellectual Philippe is a quadriplegic millionaire who is interviewing candidates for the position of his carer.",Olivier Nakache,,François Cluzet (Philippe); Omar Sy (Driss),2011
Grave of the Fireflies,,1988,89,Unrated,8.5,,"Animation, Drama, War",https://placehold.co/600x900/png?text=Grave+of+the+Fireflies,https://placehold.co/1280x720/png?text=Grave+of+the+Fireflies,https://www.youtube.com/watch?v=vymtQH19tpw,A young boy and his little sister struggle to survive in Japan during World War II.,"The story of Seita and Setsuko, two young Japanese siblings, living in the declining days of World War II.",Isao Takahata,,Tsutomu Tatsumi (Seita); Ayano Shiraishi (Setsuko),1988
Harakiri,,1962,133,Unrated,8.6,,"Action, Drama, Mystery",https://placehold.co/600x900/png?text=Harakiri,https://placehold.co/1280x720/png?text=Harakiri,https://www.youtube.com/watch?v=gfABwM-Ppng,"When a ronin requesting seppuku at a feudal lord's palace is told of the brutal suicide of another ronin who previously visited the same court, he reveals how their pasts are intertwined - and in doing so challenges the clan's integrity.","Peace in 17th-century Japan causes the Shogunate's breakup of warrior clans, throwing thousands of samurai out of work and into poverty.",Masaki Kobayashi,,Tatsuya Nakadai (Hanshiro Tsugumo); Akira Ishihama (Motome Chijiiwa); Shima Iwashita (Miho Tsugumo),1962
Casablanca,,1942,102,PG,8.5,,"Drama, Romance, War",https://placehold.co/600x900/png?text=Casablanca,https://placehold.co/1280x720/png?text=Casablanca,https://www.youtube.com/watch?v=XuYgOY6RFVo,A cynical expatriate American cafe owner struggles to decide whether or not to help his former lover and her fugitive husband escape the Nazis in French Morocco.,"Rick Blaine, who owns a nightclub in Casablanca, discovers his old flame Ilsa is in town with her husband, Victor Laszlo.",Michael Curtiz,,Humphrey Bogart (Rick Blaine); Ingrid Bergman (Ilsa Lund); Paul Henreid (Victor Laszlo),1942
Modern Times,,1936,87,G,8.5,,"Comedy, Drama, Romance",https://placehold.co/600x900/png?text=Modern+Times,https://placehold.co/1280x720/png?text=Modern+Times,https://www.youtube.com/watch?v=iXgJ5KiM33k,The Tramp struggles to live in modern industrial society with the help of a young homeless woman.,The Tramp works at a factory where he is overwhelmed by the machinery and the repetitive work.,Charlie Chaplin,,Charlie Chaplin (A Factory Worker); Paulette Goddard (A Gamin); Henry Bergman (Cafe Proprietor),1936
City Lights,,1931,87,G,8.5,,"Comedy, Drama, Romance",https://placehold.co/600x900/png?text=City+Lights,https://placehold.co/1280x720/png?text=City+Lights,https://www.youtube.com/watch?v=plEXsBm8Lm4,"With the aid of a wealthy erratic drunkard, a dewy-eyed tramp who has fallen in love with a sightless flower girl accumulates money to be able to help her medically.","A homeless tramp befriends a wealthy but eccentric millionaire, who is only friendly when drunk.",Charlie Chaplin,,Charlie Chaplin (A Tramp); Virginia Cherrill (A Blind Girl); Florence Lee (Grandmother),1931
Rear Window,,1954,112,PG,8.5,,"Mystery, Thriller",https://placehold.co/600x900/png?text=Rear+Window,https://placehold.co/1280x720/png?text=Rear+Window,https://www.youtube.com/watch?v=m01YktiEZCw,A wheelchair-bound photographer spies on his neighbors from his apartment window and becomes convinced one of them has committed murder.,Professional photographer L.B. 'Jeff' Jefferies breaks his leg while getting an action shot at an auto race.,Alfred Hitchcock,,James Stewart (L.B. 'Jeff' Jefferies); Grace Kelly (Lisa Carol Fremont); Wendell Corey (Det. Lt. Thomas J. Doyle),1954
Alien,,1979,117,R,8.5,,"Horror, Sci-Fi",https://placehold.co/600x900/png?text=Alien,https://placehold.co/1280x720/png?text=Alien,https://www.youtube.com/watch?v=V3cCVcpN-0w,"After a space merchant vessel receives an unknown transmission as a distress call, one of the crew is attacked by a mysterious life form and they soon realize that its life cycle has merely begun.",The commercial vessel Nostromo receives a distress call from an unexplored planet.,Ridley Scott,,Sigourney Weaver (Ripley); Tom Skerritt (Dallas); John Hurt (Kane),1979
